ID,Title,Abstract,Date Published,Tags,DOI,URL,Contributors,Provider
E0075-5E5-87C,Neural Mechanisms of the Rejection-Aggression Link,"Social rejection is a painful event that often increases aggression. However, the neural mechanisms of this rejection-aggression link remain unclear. A potential clue may be that rejected people often recruit the ventrolateral prefrontal cortex’s (VLPFC) self-regulatory processes to manage the pain of rejection. Using functional MRI, we replicated previous links between rejection and activity in the brain’s mentalizing network, social pain network, and VLPFC. VLPFC recruitment during rejection was associated with greater activity in the brain’s reward network (i.e., the ventral striatum) when individuals were given an opportunity to retaliate. This retaliation-related striatal response was associated with greater levels of retaliatory aggression. Dispositionally aggressive individuals exhibited less functional connectivity between the ventral striatum and the right VLPFC during aggression. This connectivity exerted a suppressing effect on dispositionally aggressive individuals’ greater aggressive responses to rejection. These results help explain how the pain of rejection and reward of revenge motivate rejected people to behave aggressively.",2018-03-19T17:29:09.462697+00:00,"exclusion,revenge,fmri,reward,self-regulation,pain,vlpfc,taylor aggression paradigm,ventral striatum,brain,neuroimaging,frontostriatal,aggression,aggressive behavior,pleasure,retaliatory aggression,cyberball,neuroscience,retaliation,social rejection",,,"C. Nathan DeWall, Richard Milich, Donald Lynam, David Chester",psyarxiv
E0239-DEE-4B3,The Role of Positive Affect in Aggression,"Aggressive behavior hurts us all and is studied across psychology’s sub-disciplines. Classical theories discuss the causes of aggression in the context of negative affect (e.g., frustration, pain). However, more recent research implicates positive affect as an important correlate and cause of aggression. Such aggressive pleasure likely evolved from ancient predatory tendencies that later yielded reproductive benefits, holds across reactive and proactive forms of aggression, and is used strategically as an item in many people’s emotion-regulation toolkit. Findings from psychological and neural sciences have converged to detail aggression's hedonically pleasant qualities and the motivational and biological mechanisms through which they occur. This new approach generates novel hypotheses and might lead to effective interventions that mollify mankind’s aggressive tendencies.",2017-08-09T17:45:01.087035+00:00,"reward,aggressive behavior,positive affect,motivation,violence,revenge,pleasure,aggression,violent behavior",,,David Chester,psyarxiv
E0084-2DD-95E,"Personality Correlates of Revenge-Seeking: Multidimensional Links to Physical Aggression, Impulsivity, and Aggressive Pleasure","People differ in how much they seek retribution for interpersonal insults, slights, rejections, and other antagonistic actions. Identifying individuals who are most prone towards such revenge-seeking is a theoretically-informative and potentially violence-reducing endeavor. However, we have yet to understand the extent to which revenge-seeking individuals exhibit specific features of aggressiveness, impulsivity, and what motivates their hunt for retribution. Toward this end, we conducted three studies (total N = 673), in which revenge-seeking was measured alongside these other constructs. Analyses repeatedly demonstrated that revenge-seeking was associated with greater physical (but not verbal) aggressiveness, anger, and hostility. Revenge-seeking’s link to physical aggression was partially accounted for by sadistic impulses toward enjoying aggression and the tendency to use aggression to improve mood. Dominance analyses revealed that such sadistic impulses explained the most variance in revenge-seeking. Revenge-seeking was associated with greater impulsive responses to negative and positive affect, as well as greater premeditation of behavior. These findings paint a picture of revenge-seekers as physically aggressive curators of anger, whose retributive acts are performed with planned malice and motivated by the act’s entertaining and therapeutic qualities.",2017-11-16T14:02:21.233084+00:00,"traits,vengeance-seeking,positive urgency,vengeance,anger,premeditation,sadism,negative affect,gender,positive affect,personality,dominance analyses,mood,aggression,impulsivity,big five,anger rumination,revenge,negative urgency",,,"David Chester, C. Nathan DeWall",psyarxiv
E0005-052-25C,Some Revenge Now or More Revenge Later? Applying an Intertemporal Framework to Retaliatory Aggression,"Retaliatory aggression is a rewarding behavior. Decisions about rewarding behaviors often involve an intertemporal bias, such that people prefer immediate rewards and discount delayed rewards. We integrated these literatures to test whether the delay discounting framework could be applied to retaliatory aggression. Across six studies (total N = 1,508), participants repeatedly chose between immediate-but-lesser or delayed-but-greater retaliation. As with other rewards (e.g., money), participants preferred immediate-but-lesser retaliation, discounting the value of delayed-but-greater revenge. Rates of aggression discounting were temporally stable and associated with greater aggressive behavior. Experimentally-induced angry rumination reduced discounting rates, motivating participants to wait longer to inflict greater harm. Participants with greater antagonistic traits (e.g., physical sadism), displayed stronger preferences for delayed-but greater vengeance. These findings suggest that some dispositionally aggressive individuals may delay retaliation in service of greater future revenge. Our results bolster the important role of reward in retaliatory aggression and suggest that an intertemporal framework is likely a fruitful area of investigation for antisocial behavior. We discuss the implications of our findings in relation to contemporary theories of aggression and broader theories of antisocial behavior.",2021-07-30T19:28:06.415987+00:00,"itap,delay discounting,mcq,acq,retaliation,aggression,retaliatory aggression,impulsivity,revenge",,,"Nayaab Khan, David Chester, Samuel James West, Calvin Hall, Emily Lasko",psyarxiv
E014E-DB9-76F,The Satisfaction Is Mine: Extrinsic Reward Reduces Desire for Revenge,"Revenge is often driven by desire to feel gratified. Consequently, extrinsic reward should diminish revengeful cravings. One hundred fourteen participants received either insulting or praising feedback from another individual, were led to believe that they or the other individual won an unexpected monetary reward, and then indicated how much they desired revenge. Participants who received insulting feedback desired revenge more than praised counterparts, yet insulted participants who won the reward desired revenge less than those who did not win. This evidence emphasizes the need for personal satisfaction as fuel for revenge as well as highlights the importance of balancing the scales in retribution seeking.",2021-10-12T08:33:20.018078+00:00,"provocation,revenge,reward",,,"Blazej Mrozinski, Karolina Dyduch-Hazar",psyarxiv
E022B-030-244,Punishment Is Strongly Motivated by Revenge and Weakly Motivated by Inequity Aversion,"There are two broad functional explanations for second-party punishment: fitness-leveling and deterrence. The former suggests that people punish to reduce fitness differences, while the latter suggests that people punish in order to reciprocate losses and deter others from inflicting losses on them in the future. We explore the relative roles of these motivations using a pre-registered, two-player experiment with 2,426 US participants from Amazon Mechanical Turk. Participants played as the “responder” and were assigned to either a Take or Augment condition. In the Take condition, the “partner” could steal money from the responder’s bonus or do nothing. In the Augment condition, the partner could augment the responder’s bonus by giving them money at no cost to themselves or do nothing. We also manipulated the responders’ starting endowments, such that after the partner’s decision, responders experienced different payoff outcomes: advantageous inequity, equality, or varying degrees of disadvantageous inequity. Responders then decided whether to pay a cost to punish the partner. Punishment was clearly influenced by theft and was most frequent when theft resulted in disadvantageous inequity. However, people also punished in the absence of theft, particularly when confronted with disadvantageous inequity. While the effect of inequity on punishment was small, our results suggest that punishment is motivated by more than just the desire to reciprocate losses. These findings highlight the multiple motivations undergirding punishment and bear directly on functional explanations for the existence of punishment in human societies.",2020-06-15T21:18:31.685209+00:00,"fitness-leveing,deterrence,competition,revenge,punishment,inequity aversion",,,"Mark Bracic, Nichola Raihani, Paul Deutchman, Katherine McAuliffe",psyarxiv
E013A-045-245,Aggression As Successful Self-Control,"A dominant narrative is that aggression starts when self-control stops --- unchecked aggressive impulses manifest in violence as self-control fails to inhibit them. Yet this ‘low self-control syndrome’ approach to aggression fails to accommodate numerous findings in which aggression arises from successful self-control. I summarize these key findings while identifying how current theories of aggression can be molded to accommodate them. This balanced perspective, which allows aggression to arise from successful and unsuccessful self-control, suggests exciting new hypotheses alongside confounding questions for aggression and self-regulation scholars. It also supports ongoing and broader paradigm shifts away from treating self-control as a purely adaptive and desirable psychological capacity and toward approaching self-control interventions with greater care, as they may amplify aggression instead of reducing it, with costly consequences.",2023-02-16T03:32:13.855378+00:00,"violence,impulse control,self-control,revenge,aggression,aggressive behavior,self-regulation",,,David Chester,psyarxiv
E01D0-389-170,Political repression motivates antigovernment violence,"We examined whether political repression deters citizens from engaging in antigovernment behavior (its intended goal), or in fact motivates it. Analyses of 101 nationally representative samples from three continents (N = 139,266) revealed a positive association between perceived levels of repression and intentions to engage in antigovernment violence. Additional analyses of fine-grained data from three countries characterized by widespread repression and antigovernment violence (N = 2,960) identified a positive association between personal experience with repression and intentions to engage in antigovernment violence. Randomized experiments revealed that memories about repression also motivate participation in antigovernment violence. These results suggest that political repression, aside from being normatively abhorrent, motivates anti-repressor violence.",2020-05-10T16:11:36.219398+00:00,"political repression,political violence,revenge,state repression",,,"Henrikas Bartusevicius, Florian van Leeuwen, Michael Bang Petersen",psyarxiv
E0169-DC7-EB6,Perceptual judgements are resistant to the advisor's perceived level of trustworthiness: a deep fake approach,"As we navigate our environment, we often make spontaneous judgments about others. Trustworthiness is a key characteristic that we judge instantly and then use when making decisions, especially when we are uncertain. While the effect of trustworthiness on social behaviour has been extensively investigated, it remains unclear how trustworthiness affects more ‘basic’ cognitive processes such as perceptual decision-making. The present study aims to fill this gap. In the first experiment (N = 100), we validated a new trustworthiness manipulation by using deep fake technology to create animated versions of perceptually trustworthy, untrustworthy, and neutral static computer-generated faces. In the second experiment (N = 199), the deep fake procedure was applied to a new set of trustworthy and untrustworthy faces that served as advisors during a perceptual decision-making task. Here participants had to indicate the direction of dots that were either moving coherently to the left or to the right (i.e., random dot motion task). Contrary to our predictions, participants did not follow the advice of the trustworthy advisors more often than the advice of the untrustworthy advisors. We did find that participants decided faster and were more confident when following the advice, but this was also not influenced by the trustworthiness of the advisors. We integrate our findings within theoretical frameworks of advice taking, domain specificity of facial trustworthiness, and task requirements.",2024-05-09T12:35:09.876570+00:00,"deep fake,faces,social cognition,trustworthiness,advice taking,perceptual decision making",,,"Sam Verschooren, Marcel Brass, Mathias Van der Biest, Frederick Verbruggen",psyarxiv
E0071-DDA-89C,Seeing is Believing: The Continued Influence of a Known AI-Generated 'Deepfake' Video,"Advances in artificial intelligence mean it is becoming easier to create highly realistic deepfake videos, which can appear to show someone doing or saying something they did not in fact do or say. Deepfakes may present a threat to individuals and society: for example, deepfakes could be used to influence elections by discrediting political opponents. Psychological research suggests that people cannot reliably identify deepfakes and thus can be influenced by their content. However, little is yet known about the potential impact of a deepfake video which has been explicitly identified and flagged as fake. We explored this issue with two preregistered studies in which participants were shown a bespoke deepfake video of a man appearing to admit to committing a crime. Participants were then asked questions about the man’s guilt, to test how they had been influenced by the video’s content. We found that most participants relied on the content of a deepfake video, even when they had been explicitly warned beforehand that it was fake. This result was observed even with participants who indicated that they believed the warning and knew the video to be fake. We also found this specific warning to be no more effective than a generic warning about the existence of deepfake videos. Our findings suggest that identifying and flagging deepfake videos will not entirely negate their influence. This has implications for legislators, policy makers, and regulators of social media platforms and online news.",2024-05-23T11:27:21.719145+00:00,"artificial intelligence,deepfake,misinformation,social media,psychology",,,"Simon Clark, Stephan Lewandowsky",psyarxiv
E00F6-DE5-8C7,Prevention of Pornographic Addiction: An Islamic Psychology Perspective,"Pornographic Addiction (PA) observed a wave of articles in the last several years, researchers are documenting the consequences of pornography on the diverse spectrum of the functioning of an individual. However, the consequences of pornography are a much-debated issue and research is inconclusive in this respect whether it causes problems like attention deficit, decreased memory, less integration, low self-esteem or heightened sense of gratification, increase in sexual knowledge, sexual satisfaction, and academic performance. The least research has been done to advance PA treatment because American Psychological Association’s unclear stand on pornography. However, some researchers suggested different therapies, but all those therapies are criticized as methodologically flawed, with fewer sample sizes and sample homogeneity. Islamic Psychology (IP) can provide an effective method of treatment in regard to PA when Western theories failed to do so. The paper extracted the preventive approach from primary sources of IP which is based on the psychological concept of Foot in the Door Technique of Freedman.",2024-06-09T22:43:38.577789+00:00,"pornography,islamic psychology,porn addiction",,,Mohammad Hashim,psyarxiv
E0190-06C-F6A,Deepfake Detection in Super-Recognizers and Police Officers,"The present study is the first empirical investigation of the relationshion between human deepfake detection performance (DDP) and individuals' face identity processing ability. Using videos from the Deepfake Detection Challenge, we investigated DDP in two unique observer groups: Super-Recognizers (SRs) and ""normal"" officers from within the 18K members of the Berlin Police. SRs were identified either via previously proposed lab-based procedures or the only existing tool for SR identification involving increasingly challenging, authentic forensic material: the Berlin Test For Super-Recognizer Identification (beSure®). Participants judged either pairs of videos, or single videos in a 2-alternative forced-choice decision setting (i.e., which of the pair, or whether a single video was a deepfake or not). We explored speed-accuracy trade-offs, compared DDP between lab-identified SRs and non-SRs, and police officers as a function of their independently measured face identity processing (FIP) ability. Interestingly, we found no relationship between DDP and FIP ability. Further work using static deepfakes created with current state-of-the-art generative models is needed to determine the value of SR deployment for deepfake detection in law enforcement.",2024-01-13T20:21:39.496175+00:00,"law enforcement,policing,super-recognizers,deepfake detection,facial identity processing",,,"Matthew J Vowels, Matthew Groh, Meike Ramon",psyarxiv
E00AC-E71-F58,"Porn Consumption, Personality, and Attitudes Towards Sexual Violence","The aim of this working paper is to examine how the consumption of violent pornography leads to the development of attitudes towards sexual violence. Drawing from Gerbner’s cultivation theory, this paper proposes a micro-level analysis of the individual. Through the analysis of the theory, this paper investigates how the act of sexual violence is a learned social behavior, often facilitated through media sources such as pornography, and how it is reinforced in society through the normalization and constant performance of such practices. Further, this paper explores the moderating role of three personal dispositions: sub-clinical psychopathy, aggression, and social desirability.",2021-12-10T20:16:35.766865+00:00,"cultivation theory,psychopathy,sexual violence,porn,aggression",,,"Siddharth Garg, Nikita Khatri, Sushma Suri",psyarxiv
E00E5-A00-48F,Investigating relationships between moral foundations and support for revenge,"Revenge is a complex phenomenon that has long attracted attention from scholars across
disciplines. In two pre-registered studies, we applied insights from moral foundations theory to
examine how moral values are associated with attitudes toward revenge. In Study 1 (N = 299),
endorsement of the binding foundations (loyalty, authority, and purity) was positively associated
with support for revenge, whereas endorsement of the individualizing foundations (harm and
fairness) was negatively associated. Study 2 (N = 852), which focused on a specific case of
sexual assault, revealed a more nuanced pattern: individualizing values were linked to justifying
the victim’s revenge and attributing responsibility to the perpetrator, while binding values were
linked to blaming the victim for engaging in revenge. Together, these findings demonstrate a
novel application of moral foundations theory to the study of retribution, offering new insight
into the moral correlates of when, and for whom, revenge is viewed as legitimate.",2025-09-29,"Binding Values,Individualizing Values,Moral Foundations,Revenge,Victim Blaming",,,"Zhaoquan Wang, Liane Young, Stylianos Syropoulos, Kyle Fiore Law",psyarxiv
E014D-8CB-36E,Facial Expression is Retained in Deep Networks Trained for Face Identification,"Facial expressions distort visual cues for identification in two-dimensional images. Face processing systems in the brain must decouple image-based information from multiple sources to operate in the social world. Deep convolutional neural networks (DCNN) trained for face identification retain identity-irrelevant, image-based information (e.g., viewpoint). We asked whether a DCNN trained for identity also retains expression information that generalizes over viewpoint change. DCNN representations were generated for a controlled dataset containing images of 70 actors posing 7 facial expressions (happy, sad, angry, surprised, fearful, disgusted, neutral), from 5 viewpoints (frontal, 90-degree and 45-degree left and right profiles). Two-dimensional visualizations of the DCNN representations revealed hierarchical groupings by identity, followed by viewpoint, and then by facial expression. Linear discriminant analysis of full-dimensional representations predicted expressions accurately (72% correct for happiness, followed by surprise, disgust, anger, neutral, sad, and fearful at 39%; chance = 14.29%). Expression classification was stable across viewpoints. Representational similarity heatmaps indicated that image similarities within identities varied more by viewpoint than by expression. We conclude that an identity-trained, deep network retains shape-deformable information about expression and viewpoint, along with identity, in a unified form—consistent with a recent hypothesis for ventral visual stream processing.",2020-05-19T16:52:44.997543+00:00,"linear discriminant analysis,deep network,emotion,object recognition,neural network,karolinska,facial expression,computer vision,face recognition,t-sne,expression",,,"ALICE O'TOOLE, Y. Ivette Colón, Carlos D. Castillo",psyarxiv
E00C9-744-B93,Deepfaked online content is highly effective in manipulating people’s attitudes and intentions,"In recent times, disinformation has spread rapidly through social media and news sites, biasing our (moral) judgements of other people and groups. “Deepfakes”, a new type of AI-generated media, represent a powerful new tool for spreading disinformation online. Although Deepfaked images, videos, and audio may appear genuine, they are actually hyper-realistic fabrications that enable one to digitally control what another person says or does. Given the recent emergence of this technology, we set out to examine the psychological impact of Deepfaked online content on viewers. Across seven preregistered studies (N = 2558) we exposed participants to either genuine or Deepfaked content, and then measured its impact on their explicit (self-reported) and implicit (unintentional) attitudes as well as behavioral intentions. Results indicated that Deepfaked videos and audio have a strong psychological impact on the viewer, and are just as effective in biasing their attitudes and intentions as genuine content. Many people are unaware that Deepfaking is possible; find it difficult to detect when they are being exposed to it; and most importantly, neither awareness nor detection serves to protect people from its influence. All preregistrations, data and code available at osf.io/f6ajb.",2021-03-08T21:28:34.047805+00:00,"implicit,disinformation,psychology,deepfake,intentions,attitudes",,,"Rian Hughes, Ciaran Hughes, Sean Hughes, Xinwei Yao, Melissa Ferguson, Ian Hussey, Ohad Fried",psyarxiv
E0203-BD9-6A0,Development and validation of the Beliefs about Revenge Pornography Questionnaire,"Revenge pornography has become an increasingly prominent topic in social and legislative discussions about sexual crime, but has received relatively little attention within psychological research. Here, we leveraged existing theorizing in the area of sexual offending proclivity to systematically develop and validate of a measure of beliefs about revenge pornography. Using a large international community sample (N = 511) we found our ‘Beliefs about Revenge Pornography Questionnaire (BRPQ)’ to be comprised of three underpinning domains: ‘Victims as Responsible’, ‘Sociological Explanations’, and ‘Revenge Pornography as a Sexual Offense’. Concurrent validity is demonstrated through relationships with trait empathy, belief in a just world, dark personality traits, and rape myth acceptance. Randomly dividing the sample, we also show that the BRPQ predicts both revenge pornography proclivity (n = 227) and social judgements of this type of offending (n = 233). Implications and future directions are discussed.",2020-11-28T22:38:34.394099+00:00,"sexual abuse,images based sexual abuse,offense proclivity,scale development,forensic psychology,scale validation,social attitudes,revenge pornography",,,"Lorraine Smith, Dean Fido, Jessie Leach, Neil Daruwala, Craig A. Harper",psyarxiv
