ID,Title,Abstract,Date Published,Tags,DOI,URL,Contributors,Provider
E0124-259-44F,"Health, News and Economic Concerns During COVID-19: A Lotka-Volterra Analysis of Google Trends","During the outbreak of a pandemic like COVID-19 it is reasonable to expect a link between the amount of news people consume and how much they worry about their health and economic situation. In this study I exploit Google searches for ""symptoms"", ""unemployment"" and ""news"" as a proxy for how much people are worried about their health and economic situation and the amount of news they consume, respectively. I then use an integrable nonautonomous Lotka-Volterra model to study the interactions among these searches in three U.S. States (Mississippi, Nevada and Utah), the District of Columbia and in the U.S. as a whole. I find that the results are very similar in all areas analyzed, and for different specifications of the model. Prior to the pandemic outbreak the interactions among health worry, economic worry and news consumption are very weak. However, from around the beginning of the pandemic these interactions intensify greatly, and unemployment predates searches for news and for symptoms. Conversely, news and symptoms proceed in mutualism. I carry out the analysis with and without mediators like porn and alcoholic drink to ensure that the results remain robust.",2020-05-10T00:29:45.449864+00:00,"news,symptoms,alcohol,unemployment,porn,covid-19,lotka-volterra",,,Chiara Sotis,psyarxiv
E005F-432-924,"How deepfake quality, media literacy, and personal attitudes shape detection, liking, and social media sharing of political deepfakes","The increasing realism and accessibility of political deepfakes pose serious risks to democratic discourse by blurring the line between authentic and manipulated media. The present study examined how deepfake quality, media literacy, and attitudes toward the person depicted in the video shape individuals’ ability to detect political deepfakes, their emotional responses (liking), and behavioral intentions (social media sharing). A total of 1,124 participants from the United Kingdom, Slovenia, and Italy viewed manipulated videos about climate change and immigration that varied in quality. The results showed that high-quality deepfakes were less likely to be detected and received more positive evaluations than low-quality ones. In contrast, quality did not significantly influence sharing intention. Media literacy and attitudes toward the person in the video emerged as strong predictors across outcomes; higher media literacy improved detection and reduced liking and sharing, while more positive attitudes decreased detection and increased both liking and sharing. Mediation analyses demonstrated that liking partially mediated the link between detection and sharing intention. Furthermore, moderated mediation models revealed that this indirect effect was stronger among individuals with high media literacy (for climate change videos) and favorable attitudes toward the video’s subject (for both topics). Overall, the study highlights the need for interventions that address not only detection skills but also emotional and motivational susceptibility to persuasive synthetic media. Enhancing media literacy and implementing platform-level friction mechanisms may help curb the spread of political deepfakes online.",2025-05-19,"attitudes,deepfake,detection,liking,media literacy,quality,sharing",,,"Urška Smrke, Michele Brienza, Nejc Plohl, Izidor Mlakar, Letizia Aquilino, Piercosma Bisconti",psyarxiv
E0164-77F-86D,Mindfulness-based relapse prevention trial for compulsive sexual behaviour disorder,"Background and aims: Compulsive sexual behaviour disorder (CSBD) is a medical condition that can impair social and occupational functioning and lead to severe distress. To date, treatment effectiveness studies of CSBD are under-developed; typically, treatment for CSBD is based on guidelines for substance or other behavioural addictions. Mindfulness-based relapse prevention (MBRP) is an evidence-based treatment for substance addiction aimed at, among other things, reducing craving and negative affect—i.e. processes that are implicated in the maintenance of problematic sexual behaviours. However, to our knowledge no prior research has been published evaluating mindfulness-based intervention in the treatment of CSBD, except two clinical case reports. Therefore, the aim of the current preliminary research was to examine whether MBRP can lead to clinical improvement in CSBD. Methods: Participants were 13 adult males with a diagnosis of CSBD. Before and after the eight-week MBRP intervention, participants completed a booklet of questionnaires including measurements of porn viewing, masturbation and emotional distress. Results: As expected, we found that after MBRP participants spent significantly less time engaging in problematic pornography use and exhibited a decrease in anxiety, depression and obsessive-compulsive symptoms. Discussion and Conclusions: The findings indicate that MBRP could be beneficial for CSBD individuals. Further clinical effectiveness studies with bigger sample sizes, delayed post-training measurements and randomised control trial design are warranted. In conclusion, MBRP leads to a decrease in time spent watching porn and a decrease in emotional distress in CSBD patients.",2020-03-23T23:32:24.192212+00:00,"csbd,addiction,mindfulness-based relapse prevention,mbrp,porn addiction,mindfulness",,,"Pawel Holas, Karol Lewczuk, Małgorzata Draps, Ewelina Kowalewska, Mateusz Gola",psyarxiv
E001C-1FF-3E1,Labeling Synthetic Content: User Perceptions of Warning Label Designs for AI-generated Content on Social Media,"In this research, we explored the efficacy of various warning label designs for AI-generated content on social media platforms—e.g., deepfakes. We devised and assessed ten distinct label design samples that varied across the dimensions of sentiment, color/iconography, positioning, and level of detail. Our experimental study involved 911 participants randomly assigned to these ten label designs and a control group evaluating social media content. We explored their perceptions relating to 1) Belief in the content being AI-generated, 2) Trust in the labels and 3) Social Media engagement perceptions of the content. The results demonstrate that the presence of labels had a significant effect on the user’s belief that the content is AI-generated, deepfake, or edited by AI. However their trust in the label significantly varied based on the label design. Notably, having labels did not significantly change their engagement behaviors, such as ’like’, comment, and sharing. However, there were significant differences in engagement based on content type: political and entertainment. This investigation contributes to the field of human-computer interaction by defining a design space for label implementation and providing empirical support for the strategic use of labels to mitigate the risks associated with synthetically generated media.",2025-02-20T11:57:42.989521+00:00,"warning labels,content labels,#ai content,deepfake images,deepfakes",,,"Arosha Bandara, Dilki, Dilrukshi Gamage, Min Zhang",psyarxiv
E012C-265-A3B,Direct versus image-based digit ratio (2D:4D) measurement compared: Performance indicators and associations with candidate traits,"Direct vs computer-assisted image-based measurements of the second-to-fourth digit ratio (2D:4D), a widely studied assumed negative correlate of prenatal testosterone, were compared in a sample of 96 men. Both methods yielded comparable associations of 2D:4D with a range of sexually differentiated personality measures, including the Big Five, aggression, hypermasculinity, and self-esteem (partly additionally assessed with implicit tasks and peer-ratings complementing the self-report measures). Directly ascertained 2D:4D was significantly less precisely measurable and significantly higher than 2D:4D ascertained from images by the same observers. In particular, measurement method impacted fingers differentially: directly measured index vs ring fingers were 1% vs 2% shorter, thereby yielding higher 2D:4D than when measured from images. Finger differences in fingertip size have been hypothesized to account for such discrepancies. However, fingertip size is unrelated to 2D:4D. Alternatively, diminished finger extensibility in supinated hand position (when taking direct measurements), as compared with finger extensibility in pronated hand position (when taking palmar-view hand images), might account for these observations. For anatomical reasons, this effect should be stronger for ring fingers than for index fingers and moreover should increase with age. The present data supported this novel hypothesis for explaining measurement-dependent differences in 2D:4D.",2021-02-01T14:12:48.370783+00:00,"intraclass correlation (icc),measurement differences,hand anatomy,self-rating,interobserver repeatability,measurement,personality,self-esteem,self-report measures,measurement methods,androgens,peer-rating,big five,digit ratio (2d:4d),measurement agreement,sex differences,prenatal testosterone,initial preference task (ipt),hypermasculinity,aggression,measurement concordance,social desirability,implicit association test (iat),fingers,reliability,implicit measures",,,"Martin Voracek, Carmen Kreutzer, Daniela Gabler, Stefan Stieger",psyarxiv
E015A-0D6-7CB,Addiction or Transgression? Moral Incongruence and Self-Reported Problematic Pornography Use in a Nationally Representative Sample,"pornography use may qualify for the new diagnosis of Compulsive Sexual Behavior Disorder (CSBD) in the forthcoming ICD-11. There is also evidence, however, that moral incongruence (i.e., a misalignment of moral beliefs about sexual behavior and actual sexual behavior) may inflate self-reports of problems associated with pornography use. Prior work suggests religiousness may drive such moral incongruence. Using a large sample matched to U.S. representative norms (Total: N=2,519; past-year pornography users: N=1,424, 66.4% men), the present work examined the interaction between pornography use and religiousness in predicting self-reported addiction to pornography. Results indicated that religiousness moderated the association between pornography use and self-reported addiction so that, despite a negative association between religiousness and use, at higher levels of religiousness, pornography use was more strongly related to self-reports of addiction.",2020-06-10T18:44:18.683945+00:00,"compulsive sexual behavior,hypersexual behavior,hypersexuality,porn addiction,sexual compulsivity,pornography,sex addiction",,,"Brinna N. Lee, Joshua B. Grubbs, Samuel Perry, Camille Hoagland, Shane W Kraus",psyarxiv
E01BC-DB6-E6C,Conspiracy Believers Underuse Social Information (Like Everyone Else),"Conspiracy believers often claim to be critical thinkers doing their “own research” instead of relying on others’ testimony. In two preregistered behavioral studies conducted in the UK and Pakistan (Nparticipants = 864, Ntrials = 5408) we test if conspiracy believers have a general tendency to discount social information (in favor of their own opinions and intuitions). We found that conspiracy mentality is not associated with social information use in text-based (Study 1) and image-based (Study 2) advice-taking tasks. Yet, we found discrepancies between self-reported and actual social information use. Conspiracy believers were more likely to report relying less on social information than actually relying less on social information in the behavioral tasks. Our results suggest that the skepticism of conspiracy believers towards epistemic authorities is unlikely to be the manifestation of a generalized distrustful mindset. Conspiracy believers may be more permeable to social influence than they sometimes claim.",2022-09-26T11:43:01.416504+00:00,"conformity,egocentric discounting,epistemic individualism,conspiracy mentality,advice taking,social information",,,"Céline Schöpfer, Sacha Altay, Frédéric Tomas, Waqas Ejaz, Kenzo Nera",psyarxiv
E015D-263-C4E,Fit-for-Purpose Creativity Assessment: Automatic scoring of the Test of Creative Thinking - Drawing Production (TCT-DP),"Creativity is now universally recognized as an essential, 21st century competency. However, there are many practical barriers to the development of creativity in schools, universities and workplaces. Chief among these is a problem of the fitness-for-purpose of creativity assessments. Highly valid and reliable creativity tests, necessary to support the development of individual creativity, are typically slow and labor-intensive to administer and score. However, recent advances in machine learning are opening up solutions to the fitness-for-purpose problem, across a range of different modes (e.g., verbal and figural) of testing. This paper describes the development of a large, image-based, multi-label classification model capable of automatically scoring the figural Test of Creative Thinking – Drawing Production (TCT-DP) with accuracies comparable to those of typical human raters. The growth of this, and similar machine learning models, promises to transform the development of creativity in education, offering rapid, accurate and cost-effective assessments that can be seamlessly integrated into teaching and learning.",2023-09-07T02:09:36.181443+00:00,"classification,machine learning,artificial intelligence,creativity,assessment,fitness for purpose",,,"David H Cropley, Sven Mathijssen, Rebecca L Marrone, Caroline Theurer",psyarxiv
E019C-B1C-E2E,"Misogyny, Violent Extremism and Interpersonal Violence: Examining the Mediating and Contingent Effects of Revenge Motivation, Hypermasculinity, Collective Narcissism and Group Threats","The growing evidence base of risk factors for violent extremism demonstrates overlaps with parallel problem areas like domestic violence, mass murder, and stalking. Yet, empirical research examining the overlap among these domains is limited. The present analysis aims to address the lack of empirical research on the relationship between misogyny, violent extremism, and interpersonal violence by conducting survey-based analyses employing a newly developed and validated psychometric scale to measure misogyny. Based on a UK nationally representative survey (n = 1500), we examine the underlying mechanisms and contingent effects linking misogyny to violent extremism and interpersonal violence. We investigate how misogyny, frustrated narcissistic entitlement, and group threats among men translate into revenge motivation and hypermasculinity and thus, may increase violent extremist intentions and attitudes, as well as justification of and willingness to engage in interpersonal violence. The results show that misogyny predicts violent extremist attitudes and intentions as well as increased support for and willingness to engage in interpersonal violence via revenge planning and hypermasculinity, particularly among men who experience frustrated narcissistic entitlement and greater threats to the ingroup. Among women, misogyny is not associated with violent extremist attitudes or intentions but is associated with increased support for and readiness to use violence. Our findings have important practical implications as we provide evidence which articulates when and for whom misogyny may be a risk factor for violent extremism and interpersonal violence. Establishing the relevance of misogyny as a risk factor for (extremist) violence may provide evidence for more targeted prevention and intervention programs.",2021-08-13T17:20:18.984355+00:00,"collective narcissism,hypermasculinity,group threats,misogyny,violent extremism,terrorism,revenge motivation",,,"Caitlin Clemmow, Bettina Rottweiler, Paul Gill",psyarxiv
E008F-EA7-7CE,Bayesian Meta-analysis of fMRI Image Data,"We composed an R-based script for Image-based Bayesian random-effect meta-analysis of previous fMRI studies. It meta-analyzes second-level test results of the studies and calculates Bayes Factors indicating whether the effect in each voxel is significantly different from zero. We compared results from Bayesian and classical meta-analyses by examining the overlap between the result from each method and that created by NeuroSynth as the target. As an example, we analyzed previous fMRI studies focusing on working memory extracted from NeuroSynth. The result from our Bayesian method showed a greater overlap than the classical method. In addition, Bayes Factors proved a better way to examine whether the evidence supported hypotheses than p-values. Given these, Bayesian meta-analysis provides neuroscientists with a better meta-analysis method for fMRI studies given the improved overlap with the NeuroSynth result and the practical and epistemological value of Bayes Factors that can directly test presence of an effect.",2018-11-14T01:31:13.662495+00:00,"meta-analysis,bayesian inference,fmri,p-value,bayesian random-effect meta-analysis,bayes factors",,,"Joonsuk Park, Hyemin Han",psyarxiv
E0153-ACC-2E6,Are we overclaiming the Psychosocial Impacts of Misinformation? A Systematic Review of Evidence,"Misinformation, or what we call ‘Technologically manipulated information’ (TMI), has a long history of shaping people's social lives. Research in this area has spiked recently, especially after the COVID-19 pandemic. With technological advancement, the ease of manipulating information, as in ‘deep fake,’ and its quick dissemination over social media has caused a stir among researchers. ’ However, in the relevant literature, a general assumption is repeatedly observed that misinformation and TMI lead to negative psychosocial impacts. The present review systematically analyzes the empirical evidence available in the research literature for the negative impact of misinformation. The aim is to gather proof for this commonly held belief about the impact and identify the gaps in the literature, if any.",2023-07-06T03:45:14.343020+00:00,"misinformation,ai,social networking sites,covid 19,psychosocial impact,and deepfakes",,,Ankita Sharma,psyarxiv
E021F-3BF-A07,Objecting to consensual experiments even while approving of nonconsensual imposition of the policies they contain,"In previous survey studies using decision-making vignettes in which respondents rated and ranked the appropriateness of universally implementing one intervention for all relevant people (A), universally implementing another intervention (B), or conducting an experiment (or A/B test) to compare these interventions before implementing the superior one, we have found that people are often averse to the A/B test, even when they approve of implementing either of the interventions the experiment contains (Meyer et al., 2019, Heck et al., 2020). However, these vignettes did not say explicitly whether or not consent to the A/B test—or to universal imposition of either A or B, untested—would be obtained. In a preregistered analysis, when we asked respondents in four of our previous survey experiments to explain their ratings, 18% of those who rated the A/B test commented negatively on the apparent lack of consent, compared to fewer than 1% of participants who rated the A or B conditions offering the same objection (Meyer et al., 2019). Because implementing A and implementing B, collectively, entail imposing the same risks on people as conducting an A/B test, this contrast is puzzling. Moreover, pragmatic trials of the sort our vignettes describe are often not feasible to conduct with consent; as a result, IRBs often waive the default requirement of consent and ethicists have also argued that consent to research is not always required. Here, in three studies using previous materials, we test the effect on experiment aversion (Heck et al., 2020; cf. Mislavsky et al., 2019) and the A/B effect (Meyer et al., 2019) of stipulating that consent to the A/B test either will or will not be obtained. In both vignettes we test, we find that negative sentiments towards experiments persist even when it is explicitly stated that consent will be obtained. While these negative sentiments are substantially reduced when consent is present (compared to when consent is absent or not mentioned), significant experiment aversion and A/B effects remain: 29–31% of participants were averse to the experiment and 32–39% ranked it as the worst decision the agent could make—even when consent would be obtained from everyone involved in the A/B test and from no one involved in either policy imposition.",2023-03-31T21:08:31.681810+00:00,"informed consent,pragmatic trial,field experiment,research ethics,experiment,trial,rct,a/b effect,consent,experiment aversion",,,"Randi L. Vogt, Michelle Meyer, Christopher F. Chabris, Rebecca Mestechkin",psyarxiv
E003A-15E-65B,"Further Examinations of Attitudes Toward Discrete Emotions, with a Focus on Attitudes toward Anger","The present research aimed to better understand individual differences in attitudes towards emotions with a focus on anger. We report findings of four studies conducted with American and Polish individuals. Results showed that individuals who have more positive attitudes toward anger are higher in trait anger (Studies 1- 4), are more likely to think about getting revenge (Study 1), and expect that getting revenge will make them feel good (Studies 1 - 2). In addition, these individuals are lower in agreeableness and lower in the tendency to engage in avoidance when angered (Studies 1 - 4). They score lower in humility (Studies 3 - 4), lower in secure romantic attachment but higher in anxious and avoidance attachment (Study 3). Finally, they are more likely to believe a wide range of conspiracies (Studies 2 - 4). Discussion focuses on the implications of these results.",2022-11-13T23:37:54.719617+00:00,"anger,humility,conspiracy beliefs,attitudes",,,"Kinga Szymaniak, Sylvia Harmon-Jones, Eddie Harmon-Jones",psyarxiv
E0066-685-5AF,"Further Examinations of Attitudes Toward Discrete Emotions, with a Focus on Attitudes Toward Anger","The present research aimed to better understand individual differences in attitudes towards emotions with a focus on anger. We report findings of four studies conducted with American and Polish individuals. Results showed that individuals who have more positive attitudes toward anger are higher in trait anger (Studies 1- 4), are more likely to think about getting revenge (Study 1), and expect that getting revenge will make them feel good (Studies 1 - 2). In addition, these individuals are lower in agreeableness and lower in the tendency to engage in avoidance when angered (Studies 1 - 4). They score lower in humility (Studies 3 - 4), lower in secure romantic attachment but higher in anxious and avoidance attachment (Study 3). Finally, they are more likely to believe a wide range of conspiracies (Studies 2 - 4). Discussion focuses on the implications of these results.",2022-11-15T21:14:58.078601+00:00,"conspiracy beliefs,attitudes,attachment,meta-emotion,avoidance,humility,anger",,,"Eddie Harmon-Jones, Kinga Szymaniak, Sylvia Harmon-Jones",psyarxiv
E01DD-770-81D,Enhancing Human Detection of Real and AI-Generated Hyperrealistic Faces,"Recent advancements in generative artificial intelligence (AI) technologies have prompted concerns about the proliferation of deepfake content—synthetic images, audio, and videos—online. StyleGan2, a powerful generative adversarial network architecture, can generate synthetic images of human faces that appear more realistic than actual human faces—a phenomenon termed AI hyperrealism. Across four preregistered experiments (total N = 661), we tested whether a novel behavioral intervention, termed DISCERN-AI, improved people’s ability to discriminate between real and synthetic StyleGan2 images. DISCERN-AI combines instructions about which visual features are diagnostic for classifying real and synthetic images with an inductive learning training protocol. In Experiment 1, participants completed a pre-test, DISCERN-AI, and a post-test. In Experiment 2, participants underwent DISCERN-AI or a control task before completing a post-test. In Experiments 3A and 3B, participants completed a shortened version of the intervention or control task, followed by an immediate post-test and a second post-test after 20 days. In all experiments, participants showed below-chance discrimination performance (AI hyperrealism) in the pre-test and control conditions. After completing DISCERN-AI, however, participants consistently showed above-chance discrimination performance, even when tested after 20 days. Together, the results provide support for an easily scalable intervention that substantially improves people’s ability to discriminate between real and synthetic StyleGan2 images.",2025-02-27T19:03:39.270656+00:00,"face perception,deepfake detection,ai hyperrealism,generative ai,artificial intelligence (ai),roc analysis",,,"Philip Anthony Higham, Mansi Pattni, Tina Seabrooke",psyarxiv
